{"title":"A human checks the machine","fps":30,"width":1920,"height":1080,"duration_frames":180,"artifact_receipts":["example-only: replace with an imported artifact id"],"scenes":[{"index":0,"start_frame":0,"duration_frames":75,"visual_prompt":"Close human face, eyes meeting camera; dark cyan practical light","narration":"I caught the model inventing a source.","music_cue":"single low piano note","on_screen_text":"It invented the receipt.","human_face":true,"asset_path":null},{"index":1,"start_frame":75,"duration_frames":105,"visual_prompt":"Close view of a source document and highlighted discrepancy","narration":"Here is the actual record and the correction.","music_cue":"quiet pulse","on_screen_text":"Check the record.","human_face":false,"asset_path":null}]}
